title,time,source,url,content
军队物资供应商库管理办法,2015-11-16,国家国防科工局信息中心,http://jmjh.miit.gov.cn/newsInfoWebMessage.action?newsId=1843&moduleId=222,（2005年总后勤部发布）内容简介   《军队物资供应商库管理办法》是根据《军队物资采购管理规定》制定、用来规范军队物资供应商库管理工作的文件。《办法》共15条，对军队物资供应商入库资质与程序、入库审批、监督检查、入库供应商变更或者注销、入库供应商的违规处罚等方面作出了规范。
军队物资应急采购管理规定,2015-11-16,国家国防科工局信息中心,http://jmjh.miit.gov.cn/newsInfoWebMessage.action?newsId=1842&moduleId=222,（2006年7月总后勤部发布）内容简介   《军队物资应急采购管理规定》以《国防法》、《国家突发公共事件总体应急预案》、《军队参加抢险救灾条例》、《后勤战备工作规定》等法律法规为依据，对军队物资应急采购工作进行了规范。《规定》共25条，明确了军队应急采购物资的范围、采购等级的划分、采购准备工作及采购方式和程序等方面的内容。
国防科工局总装备部关于鼓励和引导民间资本进入国防科技工业领域的实施意见,2015-11-18,国家国防科工局信息中心,http://jmjh.miit.gov.cn/newsInfoWebMessage.action?newsId=1845&moduleId=222,科工计(2012)733号各有关单位：为贯彻落实《国务院关于鼓励和引导民间投资健康发展的若干意见(国发(2010)13号)精神，鼓励和引导民间资本进入国防科技工业领域，结合国防科技工业实际，制定以下实施意见：一、鼓励和引导民间资本进入国防科技工业的原则和领域(一)要按照走中国特色军民融合式发展路子的要求，进一步扩大民间资本进入国防科技工业的领域和范围，完善鼓励和引导的政策措施，促进武器装备和国防科技工业发展。坚持积极鼓励、正确引导、同等对待、确保安全的原则，吸引和鼓励民间资本进入国防科技工业领域，在许可进入、任务竞争、税收优惠等方面对民间投资主体与国有军工企业实行同等待遇，加强安全保密和监督管理，确保国家秘密安全。(二)民间资本进入国防科技工业的领域包括：武器装备科研生产、国防科技工业投资建设、军工企业改组改制、军民两用技术开发。二、允许民营企业按有关规定参与承担武器装备科研生产任务(三)大力推行竞争性装备采购，吸纳符合条件的民营企业承担武器装备科研生产任务。科学设置装备市场准入条件，加快武器装备科研生产许可目录修订工作，优化许可管理范围并向社会发布。加强武器装备科研生产许可制度、装备承制单位资格审查制度和武器装备科研生产单位保密资格审查认证制度协调衔接，建立相互协调的审查认证管理机制，缩短审查认证周期。(四)民营企业可以通过与军工单位合作承担武器装备科研生产任务，也可以独立承担武器装备科研生产任务。对不直接涉及国家安全和军队机密、投资较小、通用性强、有较多合格承制单位的装备采购项目或配套任务，采用公开招标等方式鼓励民营企业参与竞争。三、鼓励民间资本进入国防科技工业投资建设领域(五)鼓励民间资本依据《国防科技工业社会投资领域指导目录(放开类)，进入国防科技工业相关领域的投资建设。凡是符合该目录要求的，均不限制民间资本投资比例。(六)民间资本参与国防科技工业投资建设的渠道和方式按照《国防科技工业社会投资项目核准和备案管理暂行办法》执行，其中对于完全由民间资本投资的放开类项目，实行备案制，项目单位需上报备案申请表。对于既有政府投资、也有民间投资的放开类项目，按照《国防科技工业固定资产投资管理暂行规定》执行。四、引导和支持民间资本有序参与军工企业的改组改制 (七)允许民间资本按照《国防科工委发展改革委国资委关于推进军工企业股份制改造的指导意见，参与军工企业股份制改造。(八)军工企业改组改制引入民间资本的，要按照国资产委《关于国有企业改制重组中积极引入民间投资的指导意见》执行。其中，涉及武器装备及其科研生产能力的，要征求国防科工局、总装备部的意见。五、鼓励民间资本参与军民两用技术开发 (九)鼓励民间资本参与开发军民两用技术和产品，参与政府组织的军工技术转民、军民两用技术开发项目。(十)对于政府组织的军工技术转民和军民两用技术开发科研项目，向国防科工局提出申请。其中涉及国防知识产权归属事项的，项目申请单位需事前征得国防科工局、总装备部国防知识产权管理部门同意。具体程序按相关办法执行。六、加强对民间投资的服务、指导和规范管理(十一)建立和完善军民结合公共服务平台，拓宽军民间信息交流渠道。建立武器装备采购信息发布制度，根据民营企业承担科研生产任务的专业领域和涉密等级，定期、定向发布装备采购信息及相关政策法规、标准规范和参与竞争的申办程序等。(十二)民营企业参与武器装备科研生产任务的，应按照《武器装备科研生产许可实施办法》和《中国人民解放军装备承制单位资格审查管理规定，申请取得武器装备科研生产许可和装备承制单位资格。(十三)进入国防科技工业领域的民营企业，应强化保密意识，建立健全保密制度，落实保密责任。其中，申请承担涉密武器装备科研生产任务的民营企业，应按照《武器装备科研生产单位保密资格审查认证管理办法，取得相应保密资格。(十四)承担武器装备科研生产任务的民营企业，应自觉接受政府和军队有关部门的监督检查，确保完成武器装备科研生产和建设任务。违反管理规定的，按照有关法律法规追究责任。对于贡献突出的民营企业，按照同等对待的原则，进行表彰和奖励。(十五)本意见鼓励进入相关领域的民间资本，仅限于境内资本，不包括外商投资和港澳台投资。二○一二年六月二十日
国防科工委关于加强国防科技资源共享的指导意见,2015-11-16,国家国防科工局信息中心,http://jmjh.miit.gov.cn/newsInfoWebMessage.action?newsId=1840&moduleId=222,（2008年2月3日以科工技〔2008〕165号文发布）    各省、自治区、直辖市国防科工委(办），各军工集团公司，委属各单位： 为认真贯彻党的十七大精神，走中国特色军民融合的发展之路，根据《国务院关于印发实施〈国家中长期科学和技术发展规划纲要(2006-2020年）〉的若干配套政策的通知》的要求，现就进一步加强国防科技资源共享工作提出以下意见： 一、国防科技资源是国防科技创新和发展的重要物质基础，加强国防科技资源共享，充分利用军民科技资源，对落实科学发展观，提高投资效率，增强自主创新能力，推动国防科技和国家科技持续发展，具有十分重要的意义。二、本意见中的国防科技资源主要是指在信息、网络等技术支撑下，由国家研究实验基地、大型科学设施与仪器设备、科学数据与信息、标准计量与检测技术体系、科技成果等组成的资源。国防科技资源共享，是指在确保国家安全的前提下，上述资源在企事业单位之间、行业之间和军民之间等实现互通互用与有偿利用。三、根据国家重大战略需求，充分发挥研究院所、委属高校、国防科技实验室和研究应用中心的作用。在基础研究、科技前沿探索、关键技术攻关、大型科学实验等方面加强交流与合作，建立相应的共享运行机制，提高研究起点，实现跨越发展。四、重视大型科学设施与仪器设备对科技创新的基础性作用，各类风洞、水池、试验场、高端仪器设备等所在单位都应制定相应措施，加大开放力度，拓展使用范围，提高使用效率。五、充分利用现代信息技术手段，发挥电子政务网、科技信息专网、国防数字图书馆等数字化科技平台的作用，促进科技信息与文献资源的共享；构建面向全行业的材料、工艺、元器件及环境与可靠性试验等共用数据库，推动共享进程。六、积极采用先进适用的民用标准用于武器装备研制，建立国家标准、军用标准和行业标准协调互补的标准体系；完善计量基准体系，高端计量仪器向民用领域开放，提供服务；推进检测与校准类实验室的国内外互认和检测结果共享。七、加强面向全国的、开放式的科技成果推广转化网络建设，集成并发布科技成果信息资源；发挥军工企业技术中心和研究应用中心的作用，制定重大共性技术推广计划，提高集成、配套能力和工程化技术服务水平，大力推进产学研结合，鼓励建设跨部门联合或区域化的产业化基地和科技园区，加速国防科技成果的推广和产业化。 八、进一步完善国防科技资源共享组织管理、知识产权管理等保障运行制度；制定国防科技资源共享的保密、降密、解密管理办法和考核、评价办法；建立技术转移成果和科枝资源共享信息制度。九、加强对国防科技资源共享体系建设的投资导向，对共享程度较高的国防科技资源，在建设和运行维护方面予以优先支持；充分利用已有的社会各类科技资源，不再重复建设；鼓励企事业单位和社会各方加大投入，积极参与国防科技资源共享平台建设。十、加强与国外知名大学、国家实验室、技术中心和著名企业等的交流与合作，建立联合实验室或技术中心；鼓励采用委托试验测试、设备租赁等多种形式，利用国外先进的科技资源，引进先进的管理制度及标准规范。十一、鼓励科技中介服务机构开展国防科技资源共享的政策咨询、成果转化、推广应用和共享评价等服务，不断提高服务水平。各部门、各单位要认真贯彻落实上述意见，组织协调本部门(单位）或本地区国防科技资源共享工作，结合自身实际，制定具体工作措施，切实把国防科技资源共享工作落到实处，形成军民互用、配置合理、运行高效的科技资源共享机制。
国防科工委关于进一步推进民用技术向军用转移的指导意见,2015-11-16,国家国防科工局信息中心,http://jmjh.miit.gov.cn/newsInfoWebMessage.action?newsId=1841&moduleId=222,    各省、自治区、直辖市国防科工委(办)，各军工集团公司，有关民口集团公司(研究总院)，委管各单位：为贯彻军民结合、寓军于民方针，促进军民良性互动、协调发展，实现国防科技工业和国民经济领域两种资源的优势互通互补互动，根据《国务院关于印发实施一、按照政府引导、平等准入、公平竞争、规范有序的原则，进一步鼓励和支持民用技术为军品科研生产服务，促进国防建设和经济建设两个能力的结合。 二、本指导意见中的民技军用，是指将民用市场上已经成熟应用或正在研究开发的技术和产品向武器装备科研生产转移的活动。三、建立民技军用信息发布平台。国防科工委牵头组织并不定期向有关使用部门、军工集团公司及武器装备研制生产单位发布可以应用于武器装备研制生产的先进民用技术信息；根据武器装备科研生产提出的需求，编制可以利用先进民用技术的科研项目指南，并按有关规定发布。 四、逐步扩大武器装备科研生产许可证的发放范围。对列入许可管理目录范围的技术及产品，在审核发放许可证时，给予拥有先进民用技术的单位同等待遇，吸引更多企事业单位参与武器装备科研生产活动。五、进一步完善国防科技工业标准体系。在满足军用需求的前提下，武器装备研制生产尽可能采用先进成熟的民用标准。六、加强民技军用过程中的知识产权保护。先进民用技术在向武器装备科研生产转移过程中，要严格按照国家有关规定依法对其知识产权进行保护和补偿。 七、进一步完善武器装备科研生产招投标制度。在不影响国家安全的前提下，逐步扩大武器装备科研生产及配套项目的招标比例，扩大信息发布范围，支持和鼓励有技术优势、有实力的单位公平地参与有关武器装备科研生产任务的竞争。 八、为民技军用创造公平的政策环境。在任务竞争、投资、税收等方面对承担民技军用任务的单位给予同等政策待遇。 九、各武器装备总承包和分承包单位要高度重视民技军用工作，积极吸纳和利用先进的民用技术和产品，提高武器装备研制生产水平。 十、承担民技军用任务的单位必须严格执行军品科研生产的保密管理、质量管理等规定，严格履行合同，保质、保量、按时完成武器装备科研生产任务。 十一、鼓励中介机构开展民技军用政策咨询、信息交流、信誉评价、认证认可等服务，不断提高服务水平。 各级国防科技工业管理部门要认真履行监督和管理职能，加强对民技军用工作的指导，促进民技军用工作规范有序进行。
关于促进卫星应用产业发展的若干意见,2015-11-16,国家国防科工局信息中心,http://jmjh.miit.gov.cn/newsInfoWebMessage.action?newsId=1836&moduleId=222,"（2004年11月26日以科工三司〔2004〕1470号文发布）    卫星应用产业是国家战略性高技术产业。应用卫星研制生产已形成系列化，正在从试验应用型向业务服务型转变，卫星应用已成为经济建设、社会发展和政府决策的重要支撑。根据《国民经济和社会发展第十一个五年规划纲要》和《国家中长期科学和技术发展规划纲要（2006—2020年）》，为贯彻落实《高技术产业发展“十一五”规划》和《航天发展“十一五”规划》，加速以卫星通信广播、卫星导航、卫星遥感应用为核心的卫星应用产业发展，建立完整的卫星运营服务、地面设备与用户终端制造、系统集成及信息综合服务产业链，促使卫星应用产业为经济社会发展更好服务，特提出以下意见。   一、加快卫星应用产业发展的指导思想。贯彻落实科学发展观，坚持远近结合、军民结合、自主研制与国际合作相结合的原则，以国民经济、社会发展和公共安全重大需求为牵引，以业务化和规模化发展为目标，以强化自主创新能力和公共服务能力建设、推进卫星应用公共资源的共享、培育卫星应用企业集群和产业链为重点，以体制机制创新和开放式发展为途径，以加强卫星应用和培育卫星应用市场为突破口，加强国家对卫星应用产业的宏观管理和政策引导，统筹规划与建设卫星及其应用系统，加大对卫星应用产业扶持力度，促使卫星应用产业成为加强与改善政府宏观管理和科学决策的重要手段,不断提高卫星应用业务化运行能力，形成具有国内外市场竞争力的新兴产业。   二、卫星应用产业发展的主要目标。到2020年，完成应用卫星从试验应用型向业务服务型转变，地面设备国产化率达80%，建立比较完善的卫星应用产业体系，促进卫星应用综合业务的发展，形成卫星通信广播和卫星导航规模化发展、卫星遥感业务化服务的产业局面；使卫星应用产业产值年均增速达到25%以上，成为高技术产业新的增长点。   三、推进卫星通信广播产业集约化发展。发挥卫星通信和卫星广播作为国家重要信息基础设施不可替代的作用，积极发展卫星通信广播综合业务，扶持发展灾害应急通信、远程教育、远程医疗等公益性卫星通信事业。   （一）进一步完善卫星通信广播的管理政策、体制、机制，合理有效整合国内卫星通信企业，推动卫星通信广播与其他行业应用相结合的综合业务的发展。   （二）进一步提高国产通信广播卫星在容量、寿命、精度、安全和可靠性等方面的性能，积极发展新型移动通信、宽带接入、移动多媒体广播、卫星直播等业务卫星。   （三）不断提高符合国家信息安全管理规定的卫星通信广播终端、地面系统及设备的核心技术开发和生产制造水平，大力扶持具有自主知识产权创新成果产业化，提高地面设备的国产化程度和应用比例。   （四）以政策推动和市场需求为导向，积极推动卫星通信、卫星广播制造业产业化发展，形成具有产业规模、国际市场竞争力的卫星通信广播制造和服务企业。   四、促进卫星导航产业规模化快速发展。加速建立自主卫星定位导航系统，提高卫星导航应用的基础保障能力，大力促进卫星导航终端设备的产业化，推进卫星导航运营关联产业的发展。   （一）加快形成建立以北斗卫星导航系统为核心的民用导航产业体制。建立统筹协调机制，研究制定北斗卫星导航系统民用应用政策，促进北斗卫星导航系统的产业化应用；对于涉及国家经济、公共安全的重要行业领域须逐步过渡到采用北斗卫星导航兼容其它卫星导航系统的服务体制，鼓励其他行业和领域采用北斗卫星导航兼容其它卫星导航系统的服务体制。   （二）加强卫星导航应用的基础保障体系建设。加快北斗卫星导航系统的建设；统筹规划国家级高精度卫星导航增强系统的建设，提高导航定位精度和完好性及其服务能力；建立健全卫星导航终端产品检测平台和公信力测评机制，不断提高导航终端产品的质量。    （三）促进卫星导航运营企业和卫星导航终端设备的产业化发展。大力推动卫星导航运营业的规模化、规范化发展；鼓励自主知识产权卫星导航接收芯片、关键元器件、电子地图、用户终端等产品的标准化和产业化。   五、着力建立业务化、一体化的自主遥感卫星应用和服务体系。以建立国家高分辨率对地观测系统为契机，提高卫星遥感应用和服务的能力和水平，推动卫星遥感数据资源共享和有效利用，促进卫星遥感应用产业的形成。   （一）促进我国遥感卫星数据的开发利用和开放共享。加强卫星遥感服务与应用体系建设，加快资源整合，逐步建成国家统一的陆地观测、气象、海洋卫星遥感数据接收和处理地面系统，基于国家自然资源和地理空间基础信息库，构建国家卫星遥感数据平台；制定统一的对地观测遥感数据标准与政策；在保证国家安全的前提下，形成卫星遥感数据开放和共享机制，促进我国自主卫星遥感数据的公益性服务、商业服务和国际市场服务。   （二）加强卫星遥感数据在重要行业和地区发展中的应用。加快应用技术研发和应用系统建设，促进遥感数据在国土资源、农业、林业、水利、气象、海洋、环境、减灾、测绘、交通、教育等领域和区域开发、城乡管理以及重大工程中的应用，实施应用示范工程，培育遥感服务企业，拓展卫星遥感应用服务产业链。   （三）全面提升我国遥感卫星数据源的自主保障能力。提高我国遥感卫星研制、运行和管理水平，加快国家高分辨率对地观测系统和业务遥感卫星系统的建设，形成连续、稳定、及时、高质的业务数据服务能力；完善遥感定标试验场等卫星遥感数据应用与产业化技术支撑体系，促进卫星遥感数据产品及公共应用平台的开发和应用。   六、加强国家对卫星应用的统筹规划和宏观管理。建立政府部门的协调机制，研究制定相关政策，统筹规划卫星、卫星应用及其相关基础设施的发展，协调空间资源、重点基础设施等重大项目的建设；各级地方政府和有关部门在积极落实国家有关总体规划的同时，应结合实际，积极推动卫星应用区域和行业的综合应用和典型示范。   七、强化自主知识产权卫星数据、产品和系统推广应用。涉及国家安全及国民经济命脉的应用领域和政府投资项目，应优先使用或采购自主知识产权卫星数据、产品和系统；在涉及卫星应用各领域政府投资项目评审中，相关评审机构要增加对应用国产卫星数据与产品的可行性评价。各级政府主管部门和行业主管部门应加紧研究卫星数据知识产权有关政策，把知识产权工作纳入到卫星应用项目的评定和管理活动中，把知识产权保护工作作为管理的重要内容。   八、加强我国卫星应用标准体系建设。加速卫星应用标准的顶层设计和重要基础性标准的研究制定，加强各行业与卫星应用领域相结合的关键技术标准的制定与推广；积极参与卫星应用标准化领域的国际合作。   九、加大对卫星应用产业基础条件建设的支持力度。加大政府对卫星应用业务系统的重要基础设施建设的投入，推动卫星应用产业基础能力建设，加强对轨道、频率等资源的规划与协调，加速形成卫星应用产业发展的基础条件。   十、加强卫星应用及产业化相关科学技术和研发投入的支持力度。加强卫星应用创新能力建设，建立若干卫星应用国家工程中心、工程实验室和重点实验室，发挥科研机构和高等院校的优势，形成企业为主体的、产学研用相结合的卫星应用技术创新体系；加大力度支持卫星应用共性、关键技术开发和工程化系统集成与重大应用工程建设。   十一、鼓励社会投资和企业参与卫星应用。国家和各级地方政府对具有产业化前景，且列入国家发展规划、以企业投资为主的重大卫星应用项目，给予投资补助或贷款贴息。通过政策环境建设，积极引导社会投资发展卫星应用产业，推进投资主体多元化。   十二、加速成果转化，推进卫星应用的产业化。鼓励各行业主管部门、科研单位等要及时发布卫星应用技术成果，促进卫星应用最新成果的转化与推广应用；组织实施卫星应用产业化专项、应用示范工程和产业发展基地，推广应用成果和经验；积极培育和发展中介机构，逐步建立卫星应用系统产品的测评和认证机制，为促进卫星应用技术和产品推广应用提供服务。   十三、扩大卫星应用产业的对外开放和国际合作。积极开展国际合作，提高应用的整体技术水平；支持企业开拓海外市场，推动卫星应用产品和服务的出口。   十四、加大人才培养、培训和宣传普及工作力度。加强专业与应用相结合的教育培训体系建设，加速卫星应用人才培养，积极开展多层次的卫星应用技术在职培训，大力宣传、普及卫星应用知识。"
